{
  "meta": {
    "name": "config-nested-path",
    "description": "Config at a non-root path — verifies --config flag is respected"
  },
  "config": {
    "filename": "config/ferrflow.json",
    "content": "{\n  \"package\": [\n    {\n      \"name\": \"myapp\",\n      \"path\": \".\",\n      \"versioned_files\": [{\"path\": \"version.toml\", \"format\": \"toml\"}]\n    }\n  ]\n}\n"
  },
  "packages": [
    {
      "name": "myapp",
      "path": ".",
      "initial_version": "1.0.0",
      "tag": "v1.0.0"
    }
  ],
  "commits": [
    {
      "message": "feat: add feature with nested config",
      "files": ["src/lib.rs"]
    }
  ],
  "expect": {
    "check_contains": ["myapp", "1.1.0"],
    "check_not_contains": ["Nothing to release"]
  }
}
