{
  "meta": {
    "name": "edge-merge-commits",
    "description": "History contains merge commits alongside conventional commits — handled correctly"
  },
  "config": {
    "content": "{\n  \"package\": [\n    {\n      \"name\": \"myapp\",\n      \"path\": \".\",\n      \"versioned_files\": [{\"path\": \"version.toml\", \"format\": \"toml\"}]\n    }\n  ]\n}\n"
  },
  "packages": [
    {
      "name": "myapp",
      "path": ".",
      "initial_version": "1.0.0",
      "tag": "v1.0.0"
    }
  ],
  "commits": [
    {
      "message": "feat: add feature on branch",
      "files": ["src/feature.rs"]
    },
    {
      "message": "Merge branch 'feature' into main",
      "files": ["src/merge-marker.rs"],
      "merge": true
    },
    {
      "message": "fix: post-merge fix",
      "files": ["src/fix.rs"]
    }
  ],
  "expect": {
    "check_contains": ["myapp", "1.1.0"],
    "check_not_contains": ["Nothing to release"]
  }
}
