{
  "meta": {
    "name": "floating-tags-monorepo",
    "description": "Monorepo with per-package floating tags"
  },
  "config": {
    "content": "{\n  \"workspace\": {\n    \"floating_tags\": true,\n    \"tag_template\": \"{name}@v{version}\"\n  },\n  \"package\": [\n    {\n      \"name\": \"core\",\n      \"path\": \"core\",\n      \"versioned_files\": [{\"path\": \"core/version.toml\", \"format\": \"toml\"}]\n    },\n    {\n      \"name\": \"cli\",\n      \"path\": \"cli\",\n      \"versioned_files\": [{\"path\": \"cli/version.toml\", \"format\": \"toml\"}]\n    }\n  ]\n}\n"
  },
  "packages": [
    {
      "name": "core",
      "path": "core",
      "initial_version": "2.0.0",
      "tag": "core@v2.0.0"
    },
    {
      "name": "cli",
      "path": "cli",
      "initial_version": "1.0.0",
      "tag": "cli@v1.0.0"
    }
  ],
  "commits": [
    {
      "message": "feat(core): add parser",
      "files": ["core/src/parser.rs"]
    },
    {
      "message": "fix(cli): handle empty input",
      "files": ["cli/src/main.rs"]
    }
  ],
  "expect": {
    "check_contains": ["core", "2.1.0", "cli", "1.0.1"],
    "check_not_contains": ["Nothing to release"]
  }
}
