{
  "meta": {
    "name": "floating-tags-disabled",
    "description": "Floating tags disabled — release happens but no floating tags are created"
  },
  "config": {
    "content": "{\n  \"workspace\": {\n    \"floating_tags\": false\n  },\n  \"package\": [\n    {\n      \"name\": \"myapp\",\n      \"path\": \".\",\n      \"versioned_files\": [{\"path\": \"version.toml\", \"format\": \"toml\"}]\n    }\n  ]\n}\n"
  },
  "packages": [
    {
      "name": "myapp",
      "path": ".",
      "initial_version": "1.0.0",
      "tag": "v1.0.0"
    }
  ],
  "commits": [
    {
      "message": "feat: add feature",
      "files": ["src/lib.rs"]
    }
  ],
  "expect": {
    "check_contains": ["myapp", "1.1.0"],
    "check_not_contains": ["Nothing to release"]
  }
}
