{
  "meta": {
    "name": "hooks-execution-order",
    "description": "All lifecycle hooks execute in correct order: preBump, postBump, preCommit, prePublish, postPublish"
  },
  "config": {
    "content": "{\n  \"workspace\": {\n    \"hooks\": {\n      \"preBump\": \"./hooks/pre-bump.sh\",\n      \"postBump\": \"./hooks/post-bump.sh\",\n      \"preCommit\": \"./hooks/pre-commit.sh\",\n      \"prePublish\": \"./hooks/pre-publish.sh\",\n      \"postPublish\": \"./hooks/post-publish.sh\"\n    }\n  },\n  \"package\": [\n    {\n      \"name\": \"mylib\",\n      \"path\": \".\",\n      \"versioned_files\": [{\"path\": \"version.toml\", \"format\": \"toml\"}]\n    }\n  ]\n}\n"
  },
  "packages": [
    {
      "name": "mylib",
      "path": ".",
      "initial_version": "1.0.0",
      "tag": "v1.0.0"
    }
  ],
  "hooks": [
    { "path": "hooks/pre-bump.sh", "content": "#!/usr/bin/env bash\necho pre-bump >> /tmp/hooks.log\n" },
    { "path": "hooks/post-bump.sh", "content": "#!/usr/bin/env bash\necho post-bump >> /tmp/hooks.log\n" },
    { "path": "hooks/pre-commit.sh", "content": "#!/usr/bin/env bash\necho pre-commit >> /tmp/hooks.log\n" },
    { "path": "hooks/pre-publish.sh", "content": "#!/usr/bin/env bash\necho pre-publish >> /tmp/hooks.log\n" },
    { "path": "hooks/post-publish.sh", "content": "#!/usr/bin/env bash\necho post-publish >> /tmp/hooks.log\n" }
  ],
  "commits": [
    {
      "message": "feat: trigger release with hooks",
      "files": ["src/lib.rs"]
    }
  ],
  "expect": {
    "check_contains": ["mylib", "1.1.0"],
    "check_not_contains": ["Nothing to release"]
  }
}
